{
  "$schema": "http://json-schema.org/draft-07/schema#",
  "title": "HPC Client GUI plugin registry",
  "type": "object",
  "required": [
    "schema_version",
    "plugin_api",
    "repository",
    "plugins"
  ],
  "additionalProperties": false,
  "properties": {
    "schema_version": {
      "const": 1
    },
    "plugin_api": {
      "const": 1
    },
    "repository": {
      "type": "object",
      "required": [
        "owner",
        "name",
        "raw_base"
      ],
      "additionalProperties": false,
      "properties": {
        "owner": {
          "type": "string",
          "minLength": 1
        },
        "name": {
          "type": "string",
          "minLength": 1
        },
        "raw_base": {
          "type": "string",
          "pattern": "^https://"
        }
      }
    },
    "plugins": {
      "type": "array",
      "items": {
        "$ref": "#/definitions/pluginEntry"
      }
    }
  },
  "definitions": {
    "semver": {
      "type": "string",
      "pattern": "^(0|[1-9][0-9]*)\\.(0|[1-9][0-9]*)\\.(0|[1-9][0-9]*)(?:-[0-9A-Za-z.-]+)?(?:\\+[0-9A-Za-z.-]+)?$"
    },
    "sha256Hex": {
      "type": "string",
      "pattern": "^[0-9a-f]{64}$"
    },
    "relativePath": {
      "type": "string",
      "minLength": 1,
      "not": {
        "oneOf": [
          {
            "pattern": "^/"
          },
          {
            "pattern": "(^|/)\\.\\.(/|$)"
          },
          {
            "pattern": "\\\\"
          },
          {
            "pattern": "[A-Za-z]:"
          },
          {
            "pattern": "^[a-zA-Z][a-zA-Z0-9+.-]*://"
          }
        ]
      }
    },
    "versionRange": {
      "type": "string",
      "pattern": "^(>=|<=|==|~=)?(0|[1-9][0-9]*)(\\.(0|[1-9][0-9]*)){0,2}$"
    },
    "pluginType": {
      "enum": [
        "cluster-profile",
        "lint-rules",
        "job-template",
        "application-tools",
        "linter-tool"
      ]
    },
    "capability": {
      "enum": [
        "cluster-profile",
        "lint-rules",
        "job-template",
        "application-tools",
        "linter-tool"
      ]
    },
    "pluginEntry": {
      "type": "object",
      "required": [
        "id",
        "name",
        "version",
        "plugin_api",
        "type",
        "description",
        "publisher",
        "requires_app",
        "manifest_path",
        "manifest_sha256",
        "official"
      ],
      "additionalProperties": false,
      "properties": {
        "id": {
          "type": "string",
          "pattern": "^[a-z][a-z0-9]*(?:\\.[a-z0-9]+)+$",
          "maxLength": 128
        },
        "name": {
          "type": "string",
          "minLength": 1,
          "maxLength": 80
        },
        "version": {
          "$ref": "#/definitions/semver"
        },
        "plugin_api": {
          "enum": [
            1,
            2
          ]
        },
        "type": {
          "$ref": "#/definitions/pluginType"
        },
        "description": {
          "type": "string",
          "minLength": 1
        },
        "publisher": {
          "type": "string",
          "minLength": 1
        },
        "requires_app": {
          "$ref": "#/definitions/versionRange"
        },
        "manifest_path": {
          "$ref": "#/definitions/relativePath"
        },
        "manifest_sha256": {
          "$ref": "#/definitions/sha256Hex"
        },
        "official": {
          "type": "boolean"
        },
        "capabilities": {
          "type": "array",
          "items": {
            "$ref": "#/definitions/capability"
          },
          "minItems": 1,
          "maxItems": 8
        },
        "keywords": {
          "type": "array",
          "items": {
            "type": "string"
          },
          "maxItems": 16
        },
        "homepage": {
          "type": "string",
          "pattern": "^https://"
        },
        "repository": {
          "type": "string",
          "pattern": "^https://"
        },
        "license": {
          "type": "string"
        },
        "compatibility_override": {
          "type": "object",
          "required": [
            "requires_app",
            "reason"
          ],
          "additionalProperties": false,
          "description": "Registry-level compatibility correction for an already published, immutable package. Narrows compatibility only; never bypasses installer schema, payload, or hash validation.",
          "properties": {
            "requires_app": {
              "$ref": "#/definitions/versionRange"
            },
            "reason": {
              "type": "string",
              "minLength": 1,
              "maxLength": 500
            },
            "recorded": {
              "type": "string",
              "pattern": "^[0-9]{4}-[0-9]{2}-[0-9]{2}$"
            }
          }
        }
      }
    }
  }
}
