{
  "schema_version": 1,
  "plugin_api": 1,
  "repository": {
    "owner": "mskomek",
    "name": "hpc-client-gui-plugins",
    "raw_base": "https://raw.githubusercontent.com/mskomek/hpc-client-gui-plugins/main/"
  },
  "plugins": [
    {
      "id": "org.hpcclient.cineca.leonardo",
      "name": "CINECA Leonardo",
      "version": "1.0.0",
      "plugin_api": 1,
      "type": "cluster-profile",
      "description": "Declarative community profile for CINECA Leonardo.",
      "publisher": "HPC Client GUI community",
      "requires_app": ">=1.5.8",
      "manifest_path": "plugins/leonardo/1.0.0/manifest.json",
      "manifest_sha256": "007166884f98f127c809b76aa6d2e6d17e0f08edfe0a244ce7533c6dae63edd7",
      "official": false,
      "capabilities": [
        "cluster-profile"
      ],
      "keywords": [
        "cineca",
        "leonardo",
        "slurm",
        "ssh-certificate",
        "cluster-profile"
      ],
      "license": "MIT"
    },
    {
      "id": "org.hpcclient.tacc.stampede3",
      "name": "TACC Stampede3",
      "version": "1.0.0",
      "plugin_api": 1,
      "type": "cluster-profile",
      "description": "Declarative community profile for TACC Stampede3.",
      "publisher": "HPC Client GUI community",
      "requires_app": ">=1.5.8",
      "manifest_path": "plugins/stampede3/1.0.0/manifest.json",
      "manifest_sha256": "c71d41bf06d92665be1356f67068108da7f23fc2f9fa4b6f9cae29772d8771b2",
      "official": false,
      "capabilities": [
        "cluster-profile"
      ],
      "keywords": [
        "tacc",
        "stampede3",
        "slurm",
        "mfa",
        "cluster-profile"
      ],
      "license": "MIT"
    },
    {
      "id": "org.hpcclient.pawsey.setonix",
      "name": "Pawsey Setonix",
      "version": "1.0.0",
      "plugin_api": 1,
      "type": "cluster-profile",
      "description": "Declarative community profile for Pawsey Setonix.",
      "publisher": "HPC Client GUI community",
      "requires_app": ">=1.5.8",
      "manifest_path": "plugins/setonix/1.0.0/manifest.json",
      "manifest_sha256": "271c8bbf38bfa0099802a3c96b56b1b861175ab5e5a8f5d3bae25c22fff1cf83",
      "official": false,
      "capabilities": [
        "cluster-profile"
      ],
      "keywords": [
        "pawsey",
        "setonix",
        "slurm",
        "cluster-profile"
      ],
      "license": "MIT"
    },
    {
      "id": "org.hpcclient.lumi",
      "name": "LUMI",
      "version": "1.0.0",
      "plugin_api": 1,
      "type": "cluster-profile",
      "description": "Declarative community profile for the LUMI supercomputer.",
      "publisher": "HPC Client GUI community",
      "requires_app": ">=1.5.8",
      "manifest_path": "plugins/lumi/1.0.0/manifest.json",
      "manifest_sha256": "7a00f92b7e97fca5880b5f6ff86735d7c45059bbad9f710f58c00e702c1ff840",
      "official": false,
      "capabilities": [
        "cluster-profile"
      ],
      "keywords": [
        "lumi",
        "slurm",
        "cluster-profile"
      ],
      "license": "MIT"
    },
    {
      "id": "org.hpcclient.nersc.perlmutter",
      "name": "NERSC Perlmutter",
      "version": "1.0.0",
      "plugin_api": 1,
      "type": "cluster-profile",
      "description": "Declarative community profile for NERSC Perlmutter.",
      "publisher": "HPC Client GUI community",
      "requires_app": ">=1.5.8",
      "manifest_path": "plugins/perlmutter/1.0.0/manifest.json",
      "manifest_sha256": "fe58e780ff0cca9c16a7c7be640c9152a2132dfb6c2fbc5d4e0e3ebdcb80ad3c",
      "official": false,
      "capabilities": [
        "cluster-profile"
      ],
      "keywords": [
        "nersc",
        "perlmutter",
        "slurm",
        "cluster-profile"
      ],
      "license": "MIT"
    },
    {
      "id": "org.hpcclient.truba",
      "name": "TRUBA",
      "version": "1.5.0",
      "plugin_api": 1,
      "type": "cluster-profile",
      "description": "TRUBA/ARF cluster profile with declarative parser/adapter contracts (schema v4).",
      "publisher": "HPC Client GUI",
      "requires_app": ">=1.5.9",
      "manifest_path": "plugins/truba/1.5.0/manifest.json",
      "manifest_sha256": "d044e4479b4186b8951e724807fb66ae72caf4a81155138df59f6484459a0c5a",
      "official": true,
      "capabilities": [
        "cluster-profile"
      ],
      "keywords": [
        "truba",
        "arf",
        "slurm",
        "cluster-profile",
        "parser",
        "adapter"
      ],
      "license": "MIT"
    },
    {
      "id": "org.hpcclient.truba",
      "name": "TRUBA",
      "version": "1.4.0",
      "plugin_api": 1,
      "type": "cluster-profile",
      "description": "TRUBA/ARF cluster profile with declarative dynamic Slurm output channels.",
      "publisher": "HPC Client GUI",
      "requires_app": ">=1.5.9",
      "manifest_path": "plugins/truba/1.4.0/manifest.json",
      "manifest_sha256": "213653be21316b652f5a9eabe6f1864a96ff44b209c1d7b18dc3b97dde2c71db",
      "official": true,
      "capabilities": [
        "cluster-profile"
      ],
      "keywords": [
        "truba",
        "arf",
        "slurm",
        "cluster-profile",
        "outputs"
      ],
      "license": "MIT"
    },
    {
      "id": "org.hpcclient.truba",
      "name": "TRUBA",
      "version": "1.3.0",
      "plugin_api": 1,
      "type": "cluster-profile",
      "description": "TRUBA/ARF defaults with conservative structured storage metadata.",
      "publisher": "HPC Client GUI",
      "requires_app": ">=1.5.5",
      "manifest_path": "plugins/truba/1.3.0/manifest.json",
      "manifest_sha256": "b7940de3f8455d89dd995c060343dd6f8da2eafcf839623c0084026a63584ecf",
      "official": true,
      "capabilities": [
        "cluster-profile"
      ],
      "keywords": [
        "truba",
        "arf",
        "slurm",
        "cluster-profile"
      ],
      "license": "MIT"
    },
    {
      "id": "org.hpcclient.truba",
      "name": "TRUBA",
      "version": "1.2.0",
      "plugin_api": 1,
      "type": "cluster-profile",
      "description": "TRUBA/ARF cluster profile with conservative structured storage metadata.",
      "publisher": "HPC Client GUI",
      "requires_app": ">=1.5.5",
      "manifest_path": "plugins/truba/1.2.0/manifest.json",
      "manifest_sha256": "00e05b4d986549e26eae2069b5162aeb6a0d28a4138ac84c066577953492a534",
      "official": true,
      "capabilities": [
        "cluster-profile"
      ],
      "keywords": [
        "truba",
        "slurm",
        "cluster-profile"
      ],
      "license": "MIT"
    },
    {
      "id": "org.hpcclient.truba",
      "name": "TRUBA",
      "version": "1.1.0",
      "plugin_api": 1,
      "type": "cluster-profile",
      "description": "TRUBA cluster profile with structured storage metadata.",
      "publisher": "HPC Client GUI",
      "requires_app": ">=1.5.5",
      "manifest_path": "plugins/truba/1.1.0/manifest.json",
      "manifest_sha256": "649f16e62606289ecec4a16681689f30ce9ccc638e874b8e43a2bce152f134ab",
      "official": true,
      "capabilities": [
        "cluster-profile"
      ],
      "keywords": [
        "truba",
        "slurm",
        "cluster-profile"
      ],
      "license": "MIT"
    },
    {
      "id": "org.hpcclient.truba",
      "name": "TRUBA",
      "version": "1.0.0",
      "plugin_api": 1,
      "type": "cluster-profile",
      "description": "TRUBA system profile for HPC Client GUI.",
      "publisher": "HPC Client GUI",
      "requires_app": ">=1.4.0",
      "manifest_path": "plugins/truba/1.0.0/manifest.json",
      "manifest_sha256": "f5f2cb9f3990a07209038658c03d908e91ec050bfcda479b40f8574a071b7390",
      "official": true,
      "capabilities": [
        "cluster-profile"
      ],
      "keywords": [
        "truba",
        "slurm",
        "cluster-profile"
      ],
      "license": "MIT"
    },
    {
      "id": "org.hpcclient.fluent",
      "name": "ANSYS Fluent Tools",
      "version": "0.1.0",
      "plugin_api": 1,
      "type": "lint-rules",
      "description": "Conservative static lint rules for ANSYS Fluent journal files.",
      "publisher": "HPC Client GUI",
      "requires_app": ">=1.4.0",
      "manifest_path": "plugins/fluent/0.1.0/manifest.json",
      "manifest_sha256": "fe7368a4eadc516c0b79a91c06411776cd4c2bce5d6f9915f5a399bd9469f513",
      "official": true,
      "capabilities": [
        "lint-rules"
      ],
      "keywords": [
        "fluent",
        "journal",
        "lint"
      ],
      "license": "MIT"
    },
    {
      "id": "org.hpcclient.fluent",
      "name": "ANSYS Fluent Tools",
      "version": "0.2.0",
      "plugin_api": 1,
      "type": "lint-rules",
      "description": "Journal lint rules and a generic Fluent Slurm job template for ANSYS Fluent.",
      "publisher": "HPC Client GUI",
      "requires_app": ">=1.4.0",
      "manifest_path": "plugins/fluent/0.2.0/manifest.json",
      "manifest_sha256": "6a08e87635c1e30a7837b5e18e2341aca93f73b95d1ef7e19113512ebd1f58d1",
      "official": true,
      "capabilities": [
        "lint-rules",
        "job-template"
      ],
      "keywords": [
        "fluent",
        "journal",
        "lint",
        "template"
      ],
      "license": "MIT"
    },
    {
      "id": "org.hpcclient.ansyslint",
      "name": "ANSYS Script & Journal Linter",
      "version": "0.1.0",
      "plugin_api": 2,
      "type": "linter-tool",
      "description": "Unofficial offline linter for Ansys journals/scripts across Fluent, MAPDL, Workbench, CCL products, ICEM, System Coupling and more.",
      "publisher": "HPC Client GUI",
      "requires_app": ">=1.5.0",
      "manifest_path": "plugins/ansys-lint/0.1.0/manifest.json",
      "manifest_sha256": "60efcfe8e3d46a25d6249472711ae924696c97f1e139b35e805e6271e4e7c1f1",
      "official": true,
      "capabilities": [
        "linter-tool"
      ],
      "keywords": [
        "ansys",
        "fluent",
        "mapdl",
        "workbench",
        "journal",
        "linter",
        "hpc"
      ],
      "license": "MIT"
    },
    {